{
  "$schema": "../greffon.schema.json",
  "nom": "qemu-mps2",
  "type": "famille",
  "version": "1.0.0",
  "description": "Machines QEMU MPS2 : UART CMSDK, Ethernet LAN9118, en-têtes CMSIS ARMCM4/ARMCM7.",
  "destination": "kernel/dev/arch/qemu-mps2",
  "bibliotheque": "kernel",
  "sources": [
    "uart",
    "eth"
  ],
  "dependances": [
    "lepton-noyau"
  ],
  "coeurs": [
    "cortex-m4f",
    "cortex-m7"
  ],
  "mcu": [
    "ARMCM4",
    "ARMCM7"
  ]
}
